Title,Location,Company,Summary
"산업용 비전 처리 S/W 개발, AI 가속기 처리 S/W 개발 경력사원",성남 중원구,여의시스템,모바일·게임>응용프로그래머>Visual C++(MFC·ATL)|인터넷·IT·통신·모바일·게임>응용프로그래머> Python|인터넷·IT·통신·모바일·게임>응용프로그래머>인공지능(AI)|인터넷·IT·통신·모바일·게임>빅데이터·AI...
"(주)딥인스펙션 인공지능 기반 S/W개발자 (연구원,팀장)",서울 송파구,딥인스펙션,"인공지능 관련 개발 유경험자 - 정부 R&D과제 수행 경험자 - Python, C/C++,Java 사용가능자, 정보처리기사소유자, 개발방법론에 따른... 용프로그래머>C#|인터넷·IT·통신·모바일·게임>응용프로그래머> Python"
소프트웨어 부문,경상남도 진주,맥시멈코퍼레이션,"인원 [담당업무] ㆍ업무:위그선 관제프로그램 개발 [C/C++ 개발필수, QT framework 개발우대, Python 개발우대] [자격요건] 경력사항: 신입, 경력(연차무관) 학력사항: 학력무관 직무기술: C/C++ 0 명..."
위메프오 서버개발자(정규직),대한민국,위메프,"데이터베이스 분산설계 및 미들웨어 개발 [자격사항] - 서버 프로그래밍 언어(PHP, Go, C/C++, Python, Java) 중 1개 이상 사용이 가능한 분 - 자료구조, 알고리즘, 분산처리 등 SW관련 기본지식 보유..."
파이썬SW 금융분야 특화 챗봇 개발 함께 할 엔지니어,서울 충정로역,파운트,"처리 과정을 Python language로 구현 - Big data 처리를 위한 SW 개발 - Backend SW 구현, Messenger interface, DBMS I/F 구현 Requirement - Python..."
AI 연구 MLOps,서울 서초구,코그넷나인,"training, Deployment System) Kubernetes GPU Cluster 관리 자격요건 Python, Golang 을 이용한 실무 개발 경험 Git 사용 실무 경험 3년 이상 Linux 인프라 세팅..."
기계학습 전문가 모집,성남 판교역,엔씨소프트,"기간 : 2년 ~ 10년 필수조건 - 딥러닝 또는 강화학습 관련 전문 지식 및 R&D 경험 필수 - R&D에 python을 능숙하게 활용 할 수 있어야 하며, pytorch, tensorflow 등 딥러닝 라이브러리를 업무에..."
Staff Field Applications Engineer,서울,Dolby,"level of programming language skills (C/C++, Java/Android, Python) is required. Excellent written and verbal communication..."
"Natural Language Processing 연구원 (자연어처리, 텍스트마이닝) 채용, 석사이상",서울,금융IT연구소 (대기업군),"연구개발, 과제관리 경험자 관련분야 실무경력 석사 2년이상(박사의 경우 실무경력 1년 이상) - 프로그래밍( Python or C/C++ or Java 등) 경험자 [우대사항] - NLP관련 솔루션 설계 및 개발 경험..."
[Data Science Div - PUBG Studio Analytic...,서울,PUBG,"data science and visualization libraries in Python or R Strong oral, organizational, and written communication skills..."
Senior Data Scientist,서울 영등포구,뱅크샐러드,"이해하고 활용하는데 어려움이 없으신 분 데이터 분석/모델링을 위한 언어 및 프레임워크 사용에 익숙하신 분 ( Python, R, SQL, Pandas, TensorFlow, Pytorch, Spark 등) 회사 내부 구성원들과..."
Junior Business Analyst (Non-tech),서울,Coupang,"의와 체계적 사고체계를 갖추신 분 [우대 조건] 이커머스, 리테일, 물류 관련 도메인 경험을 보유하신 분 Python, R 등 기타 프로그램 언어 사용 경험을 보유하신 분 한국어 및 영어 모두 능숙한 커뮤니케이션이 가능하..."
Healthcare Real World Data Analyst 담당자,서울,IQVIA,"HEOR 전반적인 업무 수행 Qualifications Claims Data 관련 분석 경력자 SAS / Python / R 등 통계 프로그래밍 언어 사용 가능자 통계학 전공자, 통계 및 Epidemiology 관련 석사..."
[Data Science Div - Business Insights De...,서울,PUBG,"analytics... digital, consumer facing company Knowledge of Python and Spark Experience with large individual customer..."
[PUBG: NEW STATE] 시네마틱 이펙터,서울,PUBG,"및 PUBG에 대한 관심과 이해 언리얼 머테리얼/블루프린트 제작에 능숙하신분 RnD 좋아하시는 분 C++, Python 사용 경험자 고용 형태 정규직 근무지 서초 본사 제출 서류 입사지원서 (자유 양식), 경력기술서 및 자기..."
Real World Evidence Science & Innovation...,서울,Novo Nordisk,"Experience in using statistical software (e.g., R, SAS, Python, SPSS... Stata), database query (SQL) or visualization..."
지표구축,경기도 성남,아프리카TV,"대시보드 플랫폼의 활용이 가능하신분 - 새로운 서비스 출시후 모니터링이나 트랜드 확인이 가능하도록 설계나 지원이 가능하신분 - SQL,Excel,R, Python 등을 이용하여 데이터 추출 또는 분석이 가능하신 분"
빅데이터시스템 운영 엔지니어,서울 서초구,케이티넥스알,"eco 활용 경험자• Hive, Hbase, Spark 활용 경험자• 프로그래밍 개발 경험 (Java, Python 등)• Technical architect 수행 경력 0 명 근무조건근무지 : 서울 서초구 효령로 176..."
게임이상탐지 분석/개발,성남 분당구,Nexon,"기법 적용에 필요한 프로그래밍 능력 ( Python) - SQL 활용 능력... 대시보드 개발 능력 솔루션 개발자 - 한 가지 이상의 개발 언어( Python, Java, Scala)에 숙련된 프로그래밍 능력 - Linux..."
[EY컨설팅] 금융컨설팅본부 리스크관리 경력 컨설턴트 모집 (00명) new,대한민국,EY,"국내외 금융기관 리스크관리 컨설팅 또는 여신업무 프로세스 개선(PI) 컨설팅 경험 - SAS, SQL, Python, R 등을 활용한 데이터분석 역량 보유자 우대 - 관련 자격증 소지자 (FRM 등) 우대 - 외국어..."
[에듀테크 스타트업] PHP 웹 개발자(프로그래머) new,서울 강남구,커넥트밸류,"상세 이력서 등록하기 지원양식 커리어 온라인 이력서 직무/산업 직무별(직종) 웹프로그래머웹프로그래머, PHP, MS-SQL, Python 응용프로그래머전산전공 산업별(업종) 포털.컨텐츠.커뮤니티 인터넷교육, 컨텐츠, 포털"
Junior Quant Trader,서울,Byzantine Partners,background is a plus Programming capability is mandatory (i.e. Python) Understanding of machine learning algorithm is a plus...
"Technical Solutions Engineer, Wear OS (E...",서울,Google,"developing web applications and programming languages (e.g., Python, Go, Java, JVM Hotspot, HTTP, HTTPS). Ability to speak..."
매칭 데이터분석,성남 분당구,Nexon,"최적화 된 모델을 적용하고 평가합니다. 지원자격 [이런 경험을 가진 파티원을 찾습니다.] - SQL, Python 등의 언어를 통해 데이터를 가공한 경험이 있는 분을 찾습니다. - 문제에 적합한 머신러닝 모델을 선택하고..."
"MD, 플랫폼 개발자",경기도 의정부,슬래디티,유통·물류·운송·운전>유통·상품기획·MD>상품MD|인터넷·IT·통신·모바일·게임>컨텐츠·사이트운영>웹사이트운영·테스터|인터넷·IT·통신·모바일·게임>웹프로그래머>JAVA|인터넷·IT·통신·모바일·게임>웹프로그래머> Python
웹솔루션 개발 사원 (JAVA/Python),서울 구로구,대연씨앤아이,"사원 채용 (JAVA/ Python) 모집부문 및 자격요건 담당업무 자격요건 인원 웹솔루션 개발자 채용 (JAVA/ Python)[담당업무]ㆍ태양광 발전... javascript, jquery), Python 언어 사용 가능한 Web..."
경력 있는 로보 콘텐츠 개발자 (정규직),서울 영등포구,주)씽크풀,모집부문 및 자격요건 담당업무 자격요건 인원 [담당업무] 파이썬( Python) 콘텐츠 알고리즘 개발 [근무부서 및 직급/직책] 근무부서... 게임>빅데이터·AI(인공지능)> Python|인터넷·IT·통신·모바일·게임...
Senior Solutions Consultant - South Kore...,서울,Cloudera,"Familiarity with scripting tools... bash shell scripts, Python... Perl, Ansible, Chef, Puppet Solid background..."
프론트엔드 정규직,서울 강남구,바이오에이아이,"프론트 엔드 구현 - DB 구축 - 신규 기능 개발 및 반영, 지속적인 개선 및 유지 보수 자격 조건 - Python, Django - RDBMS 경험 - UI개발 경험 우대 사항 - 딥러닝에 관심있으신 분 - 단위 테스트..."
AI Engineer new,경기도 성남,GE Appliances,"lite, TensorRT. 5+ years of programming experience in Python, C/C++ Experiences working on deep learning model optimization..."
[어니컴(주)] 빅데이터 기계학습/파이썬/자바웹 개발자,서울 용산구,어니컴,Azure와 같은 클라우드 환경에서의 구축 경험 ㆍ Python 활용능력 혹은 Python 기반 프로젝트 수행 경험 ㆍ리눅스(혹은 유닉스) 계열... 구축 경험 ㆍ Python 활용능력 혹은 Python 기반 프로젝트 수행...
Deep Learning Engineer new,서울,Intel,MxNet - Strong programming skills with C/C++ and Python - Experiences in programming and testing on Linux environment...
[신입/경력] 임베디드 소프트웨어 및 영상 인식 알고리즘 개발자 new,서울 구로구,몹티콘,"사용 언어 : C, C++, Python 3) 라즈베리 파이, 아두이노... 비젼, 영상 처리, 딥러닝 알고리즘 2) 사용 언어 : C, C++, Python 3) TensorFlow, Deep Learning 관련 지식 보유..."
검색&추천 소프트웨어 엔지니어,서울,myrealtrip,"경험 또는 빅데이터 영역에서 개발 경험(Spark, Hadoop, Kafka, NoSQL 등) Java/ Python 하나 이상의 능숙한 언어가 있고, 다른 랭귀지도 빠르게 배울 수 있으신 분 데이터 기반 서비스의 아이디어를..."
동국대학교 자율사물(AT)사업단 직원 채용,서울 필동,동국대학교,"5. 본교 건학이념인 불교정신을 이해하고 그 신앙생활에 동참하는 자 6. ROS 또는 동급 플랫폼 및 Python 프로그램 가능자 우대 7. 주행 및 드론 등 컴퓨터 비전 기반 제어 경험자 우대 * 연봉은 경력, 역량..."
Customer Engineer,서울,Microsoft,least 5 years welcome experience in model development using python or R. Experience in migrating from one database to another...
Deep Learning Systems Research Engineer...,서울,Qualcomm Korea YH,"PyTorch, TensorFlow... Good programming skills in Python/C/C++ - Good communication and presentation skills Preferred..."
[NAVER Cloud] MongoDB 데이터베이스 엔지니어 (DBA)...,서울,네이버,"구축, 운영, 트러블 슈팅 가능하신 분 - Backend 프로그래밍 협업 가능하신 분 (Node.js , Python 등) [ 우대사항] - 대규모/대용량 DB 운영환경을 경험하신 분 - 끊임없이 공부하고 적극적으로 공유하..."
"Natural Language Processing 연구원 (자연어처리, 텍스트마이닝) 채용, 석사이상",서울,금융IT연구소 (대기업군),"연구개발, 과제관리 경험자 관련분야 실무경력 석사 2년이상(박사의 경우 실무경력 1년 이상) - 프로그래밍( Python or C/C++ or Java 등) 경험자 [우대사항] - NLP관련 솔루션 설계 및 개발 경험..."
"딥러닝, 머신러닝 외 경력 정규직",경기도 군포,㈜AI4Blockchain,Android|인터넷·IT·통신·모바일·게임>응용프로그래머>iOS|인터넷·IT·통신·모바일·게임>응용프로그래머> Python|인터넷·IT·통신·모바일·게임>응용프로그래머>Windows|인터넷·IT·통신·모바일·게임>소프트웨어...
Data Analyst,서울,IQVIA,learning / predictive modeling ) • 통계 프로그램 활용 능력 SAS / R / Python 중 최소 1가지 중급 이상의 활용능력 요구 • Communication Basic English...
"NAVER, LINE 서비스 플랫폼 운영",성남 삼평동,NIT Service,"유하신 분 - 프로그래밍 언어( python, java, c언어 등) 초급... System, WEB/WAS, DB운영 경험 - 프로그래밍 언어( python, java, c언어 등) 중급 이상 - 국가보훈대상자 및 장애인은..."
"[주식회사 쏘마] 백엔드, 프론트엔드 외 신입/경력 정규직",성남 분당구,쏘마,"있으신 분 한 가지 이상의 프로그래밍 언어에 대한 이해(C/C++, Python, Powershell 등)가 있으신 분 악성코드 분석 및 침해사고... 서적을 관심 있게 보시는 분 python 뿐만 아니라 다른 프레임워크에..."
정보전략 담당자 모집,서울 구로구,넷마블,분 - 시스템 개발 또는 IT PM/PL 경력 3년 이상 보유하신 분 - Spring(혹은 .NET)과 Python 프로그래밍 능력을 보유하신 분 - 전략적 사고 역량을 보유하신 분 우대사항 - 관련분야 석/박사 학위 소유자...
IoT 전문가 양성 과정 훈련생,서울 금천구,한국산업기술협회,게임>빅데이터·AI(인공지능)> Python|인터넷·IT·통신·모바일·게임... 응용프로그래머> Python|인터넷·IT·통신·모바일·게임>웹프로그래머>JAVA|인터넷·IT·통신·모바일·게임>웹프로그래머> Python|전자·기계·기술...
데이터 엔지니어,서울,RIDI Corp,"에서의 데이터 파이프라인 구축 및 운영 경험 GA, Tableau 등 외부 분석/시각화 도구에 대한 지식 Python, Java, Scala 중 하나 이상을 이용한 개발 경험 추가 정보 지원 서류 안내 제출서류 : 이력..."
"[해외취업] 힙합의류 쇼핑몰, 웹 개발자 - 째끼롸웃 new",서울 역삼동,아이씨엔그룹,"그 외 자격요건 1. Must be proficient in HTML, CSS, JavaScript and Python 2. Working knowledge of Databases. 3. Should have working..."
금융 AI 기술 연구 개발자 모집,성남 판교역,엔씨소프트,"및 연구/문제 해결 능력 - Python 언어에 능숙하신 분 2. 해당직... Recognition, Data/Text Mining 경험 보유 - Python, SQL 활용 우대사항 - AI 관련 전공자 - 금융 도메인에 대한..."
기술 지원 엔지니어 - 주말전사,서울특별시,Dataiku,"이지로 이동 합니다. 직무/산업 직무별(직종) 기술영업(IT.솔루션)기술지원 웹프로그래머웹프로그래머 인공지능(AI).빅데이터R, Python 기계.자동차.조선.철강엔지니어 산업별(업종) 솔루션.ASP.소프트웨어 소프트웨어개발"
2021년 상반기 R&D 개발자 (병역특례 가능/경력 무관),인천 연수구,네오스텍,"담당업무: - 블루투스 메시 기반 위치 추적 솔루션 개발 - 상기 솔루션의 임베디드 펌웨어 개발 - C(필수), Python, Javascript 프로그래밍 언어 사용 - 기술 지원 [자격요건] 경력사항: 무관 (신입도 지원..."
Software Architecture 설계 엔지니어,성남 분당구,딥엑스,경험 - Windows/Linux 상에서 C++/ Python 언어 사용 개발 경험 - C++ / Python 언어 사용 개발 경험 - 객체지향 설계에... 게임>빅데이터·AI(인공지능)> Python|인터넷·IT·통신·모바일·게임...
콘텐츠서비스개발- 데이터엔지니어,성남 분당구,Nexon,"ecosystem 에 대한 이해 - Python, Scala 등의 프로그... 경험이나 운영 경험 - 소프트웨어 빌드 및 배포 자동화 경험 - Python 또는 NodeJS를 활용한 시스템 개발 경험 - 프론트엔드 및 웹..."
System Engineer,서울 강남구,Toss,"# 자격 요건 - Linux 환경에서 대용량 TPS 운영 경험이 있으신 분 - 스크립트 언어(shell, python, Perl, Ruby 등)를 사용하여 인프라 운영이 가능하신 분 - HTTP, TCP/IP 프로토콜에 대한..."
Lead AI Platform Developer,서울,AITRICS,"Stacks [Back-end] Language: python, golang Python Framework: Django, Bottle [Front... Language: python, golang Python Framework..."
HW/SW 분야 직무 교육 전문강사,서울 강남구,에이치에스글로벌,통신·모바일·게임>응용프로그래머>인공지능(AI)|인터넷·IT·통신·모바일·게임>빅데이터·AI(인공지능)> Python|인터넷·IT·통신·모바일·게임>빅데이터·AI(인공지능)>빅데이터|인터넷·IT·통신·모바일·게임>빅데이터·AI...
(주)아이옵스 소프트웨어 개발자,대전 유성구,아이옵스,"트스트랩, 웹개발, C++, C#, python, java 등 1개 이상의... 우대사항] - 자바스크립트, 부트스트랩, 웹개발, C++, C#, python, java 등 1개 이상의 개발환경 능숙자 - Windows..."
[NIT Service] NAVER IDC 서버 운영/관리(춘천),강원도 춘천,엔아이티서비스,"application 운영 경험 - Shell script, python 활용 가능 - 해외 데이터센터 인프라 구축 또는 운영 경험 - 국가보훈대상자... 경험 - Shell script, python 활용 가능 - 해외 데이터센..."
Datacenter Engineer (강원도 춘천 근무),서울,Oracle,"Base Operating System Install • Some experience with Perl, Python, Bash or Java • Core OS Services: ssh, telnet, ftp, nfs..."
Cloud Architect,서울,Oracle,"etc. Shell Script, Python or Java Script... development languages... Java and Python Development and operation experience..."
"머신러닝, 데이터분석 외 경력 정규직",서울 강남구,에임즈인터내셔널코리아,"혹은 그에 상응하는 실무 경력 - Python 기반의 머신러닝 프레임워크... SQLAlchemy, OpenCV, pytest -Language: Python, SQL -Github, Yona, Git 0 명 근무조건 고용형태..."
Server Engineer (Engineering Foundation),서울 영등포구,뱅크샐러드,"대한 지식 및 판단을 토대로 뱅크샐러드 적용 가능성 제시 자격 요건 Golang/Java(Kotlin)/ Python 중 하나 이상을 이용한 서비스 설계 및 개발 경험 보유 CS Fundamental (자료 구조, 운영체제..."
Cloud Support Engineer - Storage & CDN,서울,Amazon Web Services Korea LLC,"object storage · Experience with scripting (i.e. Bash, Python, PowerShell etc.) · Good understanding of networking protocols..."
Security Engineer (모의해킹),서울 강남구,Toss,"분 - INTEL/ARM 아키텍처 바이너리 분석 가능한 분 - 코드리뷰를 통한 보안 진단 능숙한 분 - Python, C, C++, C#, JAVA 중 프로그래밍 언어에 능숙한 분 # 우대 사항 - 버그바운트 경험이 있는 분..."
[Engineering] Full Stack Developer,서울,"Miso, inc","이런 분과 함께하고 싶습니다] 개발 경력 3년 이상 Ruby, Python, Go, Node JS 중 하나 이상의 언어에 능숙하신 분 Ruby... JS), Ruby, Python and Go Mobile..."
디지털자산(암호화폐) 퀀트 트레이더 (경력),대한민국,네오위즈,"경험이 있는 분 - 또는 운용사 및 증권회사에서 근무한 경력이 있는 분 우대사항 - 프로그래밍 능력( Python, R 등)을 보유하고, 개발해 본 경험이 있는 분 - 컴퓨터공학, 금융공학, 수학, 통계학을 전공한 분..."
"Perception Engineer, Deep Learning - Aut...",서울,NVIDIA,"PyTorch, etc). Strong programming skills in C++... python. Outstanding communication and collaboration skills as we..."
[NAVER Cloud] MySQL 데이터베이스 엔지니어 (DBA) 경력...,서울,네이버,"분 - 새로운 기술이나 New Feature에 대해 관심이 많으신 분 - 기본적인 수준의 프로그래밍 (c, python, golang등)이 가능하신 분 [ 우대사항] - 대규모/대용량 DB 운영환경을 경험하신 분 - 끊임없..."
머신러닝 엔지니어 모집,성남 판교역,카카오,"델의 성능 검증 및 지속 개선 대규모 로그 데이터 통계 분석을 통한 피쳐 추출 지원자격 #필수사항 Python, Java, C++ 등 언어 중 하나 이상 활용 가능하신 분 TensorFlow/Keras, PyTorch..."
Field Service Engineer,경기도 용인,Nearfield Instruments,"troubleshooting. Preferably to have coding capability (Matlab, Python...etc... data analysis, visualization, and algorithm..."
"Field Applications Engineer, Audio",서울,Dolby,"High level or detailed knowledge of SOC design. C/C++, python coding skills. Knowledge of music, audio/video production..."
로봇 시스템 아키텍쳐 및 다중 분산 시스템 아키텍쳐 new,서울 중구,국내 대기업 / 화물 운송업 / 조단위 이상 매출 기업,"경험 또는 물류사업 이해도를 갖춘 경력 우대 • 요구조건 - 중급 이상의 프로그래밍 언어 (C/C++, Python, JAVA) 활용능력 보유자 - 영어/중국어 회화 중급(OPIc IM2 또는 이에 상응하는 레벨) 이상..."
2021 Market Data Analyst - Seoul,서울,Bloomberg,"work experience using one more programming language... Python, SQL and R Fluency in Korean and English (both spoken..."
석유화학사업본부 AI/BIg Data 분야 경력사원 new,서울 영등포구,LG화학,모델 구축 (연간 과제 수행 건수 : 3~4건) - 주요 언어는 Python이며 R도 가능(C등 Compiler 언어는 미사용) - Decision... 알고리즘 활용 역량 - Python/C++/Java/C# 프로그램 역량...
[진행중] 우리은행 빅데이터사업부 전문직(데이터 사이언티스트(데이터분석가...,서울 회현동,우리은행,ML/DL 기술을 활용한 분석모델 개발 및 서비스를 적용해 본 경험이 있는자 - 데이터 분석을 위한 언어( Python/R)를 하나 이상 능숙하게 다룰 수 있는자 우대사항 - 금융분야 ML/DL 관련 업무 경력 2년...
Data Scientist - IBM Garage,서울,IBM,"programming languages to derive meaningful data insights (e.g., Python, R, Spark, TensorFlow, Jupyter, etc.) * Possess..."
AI 비전 인식 시스템 및 아키텍쳐 설계 알고리즘 개발 new,서울 중구,국내 대기업 / 화물 운송업 / 조단위 이상 매출 기업,"제어 SW 개발 또는 구축 프로젝트 경험자 • 요구조건 - 프로그래밍 언어 활용 능력(C / C++, Python) - 주요 머신러닝 및 비전 패키지 활용 능력 - 리눅스OS 기반 개발 - 임베디드 시스템 개발 - DB..."
CHC – Business intelligence - TOM_2136,서울,Sanofi,"degree in related field Business-level experience with R, Python Experience owning the analytics and performance of a large..."
"Engr, Apps Dev 3",대한민국,KLA-Tencor,"working effectively with different cultures. Matlab/ Python experience is a plus. We offer a competitive, family friendly..."
21년 전문연구요원 (AI엔지니어),성남 분당구,Nexon,"대상자 - 병역의무가 없거나 면제된 분, 병역의 의무를 마치신 분은 본 공고의 대상에서 제외됨 - Python에 숙련된 프로그래밍 능력과 머신러닝 라이브러리 활용 경험 - 머신러닝과 강화학습에 관련된 지식 습득 혹은..."
[2021인턴] AI R&D - Speech AI new,성남 판교역,엔씨소프트,개발합니다. 지원자격 학력 : 전문학사 이상 필수조건 [ 이런 역량을 갖춘 NC 인턴을 찾습니다! ] - Python을 이용한 프로그래밍 경험이 있으신 분 - 데이터 마이닝/딥러닝/인공지능에 대한 기본 지식이 있으신 분...
[Papago] 파파고 머신러닝(컴퓨터비전) 엔지니어 체험형 인턴,서울,네이버,"enhnacement [자격요건] · (학부/대학원) 컴퓨터비전/신호처리 관련 전공으로 재학 혹은 졸업하신 분 · Python 등의 프로그래밍 언어를 다루실 수 있는 분 · TensorFlow, PyTorch 등의 딥러닝..."
Sales Operations Specialist,서울,3M,"Experience using Data and business intelligence Tool... Python, Power BI, etc. Proficiency in MS Office (advanced Excel..."
"[펜타시큐리티] 보안S/W 개발 및 기획자 (웹, 인증, 블록체인) new",서울 영등포구,펜타시큐리티시스템,인터넷·IT·통신·모바일·게임>웹프로그래머>JAVA|인터넷·IT·통신·모바일·게임>웹프로그래머> Python|인터넷·IT·통신·모바일·게임>응용프로그래머>C·C++|인터넷·IT·통신·모바일·게임>응용프로그래머>JAVA|인터넷...
Data Scientist,서울,Motion2AI,"thinking to define unstructured problems - Experience with Python (pandas, numpy), R, SQL... VBA to deal... large..."
동국대학교 데이터분석팀 연구원(계약직) 채용공고,서울 필동,동국대학교,"자 4) 남자의 경우 병역필 또는 면제자 5) 한글, MS OFFICE 등 기본 문서작업 가능자 6) Python, R 프로그래밍 언어 사용 가능자 우대 2. 모집인원 : O명 3. 근무조건 및 계약기간 구 분..."
[법무법인(유)율촌] 경영정보팀 직원 new,서울 강남구,법무법인 (유한)율촌,"- 신입 ~ 5년 경력자 - SQL, Python, R 등 데이터 분석 도구... 이상직무기술 : 경영정보팀기타 - 신입 ~ 5년 경력자 - SQL, Python, R 등 데이터 분석 도구 사용 능력 (한 가지 이상 필수) - 데이..."
기술연구소 (AI연구 및 Python개발 / 드론 영상처리),고양 덕양구,선영종합엔지니어링,어링 기술연구소 (AI연구 및 Python개발 / 드론 영상처리) 채용 4... 프로그래밍 ㆍBig Data 활용 및 Smart plant ㆍR 및 Python 기반 프로그램 개발 ㆍ정부출연사업 제안서 작성 [근무부서 및 직급...
Cognitive and AI Engineer new,서울,IBM,"data science skills : Machine Learning, Deep Learning, Watson, Python, R, Spark Web application development skills Required..."
NLP Researcher,서울,AITRICS,"Stacks [Back-end] Language: python, golang Python Framework: Django, Bottle [Front... Language: python, golang Python Framework..."
Cloud Support Engineer - Linux,서울,Amazon Web Services Korea LLC,"NoSQL(Redis, Memcached). · Programming/scripting in Python/Java/Shell/Perl/Ruby/PHP/etc. · Experience managing full..."
"기술연구소 정규직 연력(Java, Python, 기타)및 개발자 (경력1... new",서울 송파구,파인씨앤아이,"트웨어 개발 및 AI, 통계분석I)- 경력 : Java 개발경험 10년이상-개발언어 : Java, C++, Python, Node 등 [근무시간 및 형태] 주 5일 근무 (오전) 9시 00분~(오후) 6시 00분 주소정근로시..."
AR App Engineer,서울,Hyperconnect,"C/C++ OpenGL/Vulkan/Metal 1 ARcore ARKit 1 / / Java, Objective C(Swift), Python OpenCV (Image Processing... 10:00 - 7:00)"
